{
  "fixture_id": "unauth-demo-v1-display",
  "fixture_version": "p00.1",
  "non_computing": true,
  "synthetic_only": true,
  "timezone": "Europe/London",
  "currency": "GBP",
  "period": "2026-01-01 inclusive to 2026-07-01 exclusive",
  "as_of": "2026-06-30T11:00:00Z",
  "surfaces": [
    {
      "surface_id": "hero_overview",
      "order": 1,
      "normal": [
        { "id": "overview.exposure", "order": 1, "label": "Payout exposure", "display": "£284,620.00", "definition_kind": "chart_measure", "definition_id": "payout_exposure_position.v1", "value_kind": "known_derived", "selector_lane": "qualifiedActual", "unit": "currency", "currency": "GBP", "bounds": null, "qualifiers": ["Known", "Exact", "Synthetic display fixture"], "provenance": "unauth-demo-v1 locked synthetic inputs", "scope": "locked demo workspace", "period_or_as_of": "as-of 2026-06-30T11:00:00Z", "permission_label": "Review permitted; merchant decision separate" },
        { "id": "overview.recovered", "order": 2, "label": "Ledger-confirmed Recovered", "display": "£118,400.00", "definition_kind": "chart_measure", "definition_id": "recovered_position.v1", "value_kind": "known_derived", "selector_lane": "reconciledActual", "unit": "currency", "currency": "GBP", "bounds": null, "qualifiers": ["Known", "Exact", "Ledger-confirmed"], "provenance": "unauth-demo-v1 locked ledger postings", "scope": "locked demo workspace", "period_or_as_of": "as-of 2026-06-30T11:00:00Z", "permission_label": "View permitted" },
        { "id": "overview.modelled", "order": 3, "label": "Modelled avoided exposure", "display": "£84,000.00", "definition_kind": "chart_measure", "definition_id": "modelled_avoided_exposure_interval.v1", "value_kind": "known_derived", "selector_lane": "counterfactualModelled", "unit": "currency", "currency": "GBP", "bounds": { "lower_display": "£76,000.00", "point_display": "£84,000.00", "upper_display": "£92,000.00" }, "qualifiers": ["Modelled", "counterfactual-control-v1", "baseline no-control-v1", "assumption stable-order-mix-v1", "version 1.0"], "provenance": "unauth-demo-v1 counterfactual fixture", "scope": "locked reporting period", "period_or_as_of": "2026-01-01 to 2026-07-01", "permission_label": "Informational only; never actual or recovered" },
        { "id": "overview.realised", "order": 4, "label": "Realised loss", "display": "£164,800.00", "definition_kind": "metric", "definition_id": "gross_loss.v1", "value_kind": "known_derived", "selector_lane": "reconciledActual", "unit": "currency", "currency": "GBP", "bounds": null, "qualifiers": ["Known", "Exact", "Reconciled actual"], "provenance": "unauth-demo-v1 locked loss records", "scope": "locked reporting period", "period_or_as_of": "2026-01-01 to 2026-07-01", "permission_label": "View permitted" },
        { "id": "overview.net_loss", "order": 5, "label": "Net loss", "display": "£46,400.00", "definition_kind": "metric", "definition_id": "net_loss.v1", "value_kind": "known_derived", "selector_lane": "reconciledActual", "unit": "currency", "currency": "GBP", "bounds": null, "qualifiers": ["Known", "Exact", "Recovered applied £118,400.00", "Excess recovery £0.00"], "provenance": "unauth-demo-v1 locked metric output", "scope": "locked reporting period", "period_or_as_of": "2026-01-01 to 2026-07-01", "permission_label": "View permitted" },
        { "id": "overview.estimated", "order": 6, "label": "Estimated realised loss", "display": "£21,600.00", "definition_kind": "chart_measure", "definition_id": "estimated_realised_loss_interval.v1", "value_kind": "known_derived", "selector_lane": "estimatedActual", "unit": "currency", "currency": "GBP", "bounds": { "lower_display": "£18,200.00", "point_display": "£21,600.00", "upper_display": "£24,900.00" }, "qualifiers": ["Estimated actual", "gap-observation-v1", "confidence 0.80", "assumption observed-gap-v1", "exclusions none"], "provenance": "unauth-demo-v1 estimate fixture", "scope": "locked reporting period", "period_or_as_of": "as-of 2026-06-30T11:00:00Z", "permission_label": "Informational; excluded from reconciled actual" },
        { "id": "overview.attention", "order": 7, "label": "Needs attention order", "display": "CASE-24017, REC-1042, RECON-882, SRC-09, RULE-DRAFT-17", "definition_kind": "record", "definition_id": "overview.needs_attention.v1", "value_kind": "label_only", "selector_lane": "not_applicable", "unit": "text", "currency": null, "bounds": null, "qualifiers": ["Exactly five rows", "Locked order"], "provenance": "unauth-demo-v1 shared data sheet", "scope": "locked demo workspace", "period_or_as_of": "as-of 2026-06-30T11:00:00Z", "permission_label": "Permission-filtered links" }
      ],
      "alternate_states": [
        { "state": "partial", "fixture_id": "overview-partial-v1", "display": "Known subtotal — some source scope is missing", "qualifier": "Partial scope; never complete total", "permission_label": "View permitted" },
        { "state": "stale", "fixture_id": "overview-stale-v1", "display": "Data stale — as-of remains visible", "qualifier": "Stale interval hatched", "permission_label": "Decision use blocked" },
        { "state": "unavailable", "fixture_id": "overview-unavailable-v1", "display": "Unavailable", "qualifier": "No zero substitution", "permission_label": "View permitted" },
        { "state": "permission", "fixture_id": "overview-permission-v1", "display": "Permission required", "qualifier": "Amounts not disclosed", "permission_label": "View denied" },
        { "state": "error", "fixture_id": "overview-error-v1", "display": "Overview unavailable — try again", "qualifier": "No stale success", "permission_label": "Retry permitted" }
      ]
    },
    {
      "surface_id": "cases_workbench",
      "order": 2,
      "normal": [
        { "id": "case.identity", "order": 1, "label": "Case", "display": "CASE-24017", "definition_kind": "record", "definition_id": "case.id", "value_kind": "label_only", "selector_lane": "not_applicable", "unit": "text", "currency": null, "bounds": null, "qualifiers": ["Synthetic case"], "provenance": "unauth-demo-v1", "scope": "CASE-24017", "period_or_as_of": "as-of 2026-06-30T11:00:00Z", "permission_label": "Case review permitted" },
        { "id": "case.exposure", "order": 2, "label": "Payout exposure", "display": "£18,400.00", "definition_kind": "semantic", "definition_id": "case.payout_exposure", "value_kind": "known_atomic", "selector_lane": "decisionSafe", "unit": "currency", "currency": "GBP", "bounds": null, "qualifiers": ["Known", "Exact", "One incomplete carrier-proof node"], "provenance": "unauth-demo-v1 CASE-24017 evidence", "scope": "CASE-24017", "period_or_as_of": "as-of 2026-06-30T11:00:00Z", "permission_label": "Request evidence permitted; merchant decision not yet safe" },
        { "id": "case.recommendation", "order": 3, "label": "Recommendation", "display": "Request evidence", "definition_kind": "authority", "definition_id": "recommendation.request_evidence", "value_kind": "label_only", "selector_lane": "not_applicable", "unit": "status", "currency": null, "bounds": null, "qualifiers": ["Recommendation is not merchant authority", "No merchant decision"], "provenance": "unauth-demo-v1 recommendation fixture", "scope": "CASE-24017", "period_or_as_of": "as-of 2026-06-30T11:00:00Z", "permission_label": "Safe next action: Request carrier proof" }
      ],
      "alternate_states": [
        { "state": "partial", "fixture_id": "cases-partial-v1", "display": "Evidence incomplete", "qualifier": "Known evidence remains visible", "permission_label": "Decision blocked" },
        { "state": "stale", "fixture_id": "cases-stale-v1", "display": "Case evidence stale", "qualifier": "Refresh required", "permission_label": "Decision blocked" },
        { "state": "unavailable", "fixture_id": "cases-unavailable-v1", "display": "Exposure unavailable", "qualifier": "No zero substitution", "permission_label": "Review only" },
        { "state": "permission", "fixture_id": "cases-permission-v1", "display": "Case access denied", "qualifier": "Evidence redacted", "permission_label": "View denied" },
        { "state": "error", "fixture_id": "cases-error-v1", "display": "Case unavailable — retry", "qualifier": "Draft context retained", "permission_label": "Retry permitted" }
      ]
    },
    {
      "surface_id": "recovery_portfolio",
      "order": 3,
      "normal": [
        { "id": "recovery.positions", "order": 1, "label": "Recovery position", "display": "Sought £246,000.00; Approved £190,000.00; Pending receipt £71,600.00; Recovered £118,400.00; Outstanding £71,600.00", "definition_kind": "chart_measure", "definition_id": "recovery_position.v1", "value_kind": "known_derived", "selector_lane": "reconciledActual", "unit": "currency", "currency": "GBP", "bounds": null, "qualifiers": ["V06 fixed order", "Approved is not received", "Outstanding is a residual, not a stage"], "provenance": "unauth-demo-v1 recovery records and ledger postings", "scope": "locked recovery portfolio", "period_or_as_of": "as-of 2026-06-30T11:00:00Z", "permission_label": "Portfolio view permitted" }
      ],
      "alternate_states": [
        { "state": "partial", "fixture_id": "recovery-partial-v1", "display": "Known recovery subtotal", "qualifier": "Missing providers listed", "permission_label": "View permitted" },
        { "state": "stale", "fixture_id": "recovery-stale-v1", "display": "Recovery position stale", "qualifier": "Receipt confirmation blocked", "permission_label": "Review only" },
        { "state": "unavailable", "fixture_id": "recovery-unavailable-v1", "display": "Recovery unavailable", "qualifier": "No funnel or zero", "permission_label": "View permitted" },
        { "state": "permission", "fixture_id": "recovery-permission-v1", "display": "Recovery access denied", "qualifier": "Amounts hidden", "permission_label": "View denied" },